{
    "version": "1.0",
    "name": "Simple Test Level",
    "author": "pb_core",
    "difficulty": 1,
    "grid": {
        "cols_even": 8,
        "cols_odd": 7,
        "rows": 12,
        "bubbles": [
            {"color": 0}, {"color": 1}, {"color": 0}, {"color": 1},
            {"color": 2}, {"color": 2}, {"color": 1}, {"color": 0},
            {"color": 1}, {"color": 0}, {"color": 1}, {"color": 2},
            {"color": 0}, {"color": 1}, {"color": 2},
            {"color": 2}, {"color": 2}, {"color": 0}, {"color": 0},
            {"color": 1}, {"color": 0}, {"color": 1}, {"color": 2},
            null, null, null, null, null, null, null,
            null, null, null, null, null, null, null, null
        ]
    },
    "objectives": {
        "clear_all": true
    }
}
